{"dialect": "pub_med", "limits": {"filters": [], "languages": [], "publication_date": null, "publication_types": [], "rationale": []}, "notes": ["Outcome terms intentionally omitted pending gold-set testing."], "query": {"children": [{"children": [{"op": "term", "term": {"explode": false, "fields": ["title_abstract"], "phrase": false, "text": "child", "truncation": true, "vocabulary": null}}, {"op": "term", "term": {"explode": true, "fields": ["subject_heading"], "phrase": true, "text": "Pediatrics", "truncation": false, "vocabulary": "MeSH"}}], "op": "or"}, {"children": [{"op": "term", "term": {"explode": false, "fields": ["title_abstract"], "phrase": true, "text": "exome sequencing", "truncation": false, "vocabulary": null}}, {"op": "term", "term": {"explode": false, "fields": ["title_abstract"], "phrase": true, "text": "whole genome sequencing", "truncation": false, "vocabulary": null}}], "op": "or"}], "op": "and"}, "review_id": "demo-paediatric-metabolic-search", "schema_version": "org.searchright.search-strategy.v1", "source_id": "medline-pubmed", "strategy_id": "strategy-medline-v1", "translated_from": null}
